Jugador,Los objetivos del juego eran claros,Los objetivos de cada nivel del juego eran claros,Los objetivos de los puzles del juego eran claros,La retroalimentación de mi progreso en el juego era adecuada,La retroalimentación de mis acciones para resolver los puzles era adecuada,La retroalimentación del efecto de mis acciones en el juego era oportuna,La retroalimentación recibida me permitía saber mi progreso para lograr los objetivos del juego,El nivel de desafío del juego se adaptaba a mi habilidad,El nivel de desafío del juego variaba en la medida que progresaba en el juego,El juego provee nuevos desafíos con una progresión adecuada,El juego provee puzles con desafíos de diferentes niveles de dificultad,He disfrutado la experiencia de jugar el juego,Fue satisfactorio encontrar como resolver cada uno de los desafíos del juego,Una de mis motivaciones para continuar jugando era resolver los nuevos desafíos que se me presentaban,Siento que tengo el control sobre mis acciones y su impacto en el juego,Siento que tengo el control sobre mi éxito y avance en el juego,Siento que puedo decidir cómo avanzar en el juego,Ingresa aquí comentarios generales e ideas,Las mecánicas del juego se relacionan con los conceptos que se quieren enseñar,Las mecánicas del juego ayudan a ejemplificar los conceptos que se pretenden enseñar,Participar en el juego ayuda a comprender los conceptos propuestos en forma práctica
Jugador 1,5,5,5,5,5,5,5,5,5,5,5,5,5,5,5,5,Buen juego, se ve bien elaborado y fluido. Además, se ajusta cada nivel a un aumento de dificultad.,5,5,5
Jugador 2,5,5,5,5,5,5,5,5,5,5,5,5,5,5,5,5,buen juego, cumple con los desafíos esperados,5,5,5
Jugador 3,5,4,5,5,5,5,5,5,5,5,5,5,5,5,5,5,4,Bastante completo el juego, le agregaría detalles o carteles que expliquen como funcionan los puzles, por lo demás bastante completo,4,5,5
Jugador 4,5,5,5,5,5,5,5,5,5,5,5,5,5,5,4,5,5,El gameplay basico es bastante bueno pero el manejo de la camara podria ser mejor,5,5,5
Jugador 5,5,5,5,5,3,5,5,5,5,5,5,5,5,5,5,5,5,Claridad de interactuables,5,5,5
